{
  "$defs": {
    "Parameter": {
      "additionalProperties": false,
      "properties": {
        "name": {
          "minLength": 1,
          "pattern": "\\S",
          "title": "Name",
          "type": "string"
        },
        "unavailable_reason": {
          "anyOf": [
            {
              "minLength": 1,
              "pattern": "\\S",
              "type": "string"
            },
            {
              "type": "null"
            }
          ],
          "title": "Unavailable Reason"
        },
        "unit": {
          "minLength": 1,
          "pattern": "\\S",
          "title": "Unit",
          "type": "string"
        },
        "value": {
          "anyOf": [
            {
              "pattern": "^-?(0|[1-9][0-9]*)(\\.[0-9]+)?$",
              "type": "string"
            },
            {
              "type": "null"
            }
          ],
          "title": "Value"
        }
      },
      "required": [
        "name",
        "value",
        "unit",
        "unavailable_reason"
      ],
      "title": "Parameter",
      "type": "object"
    },
    "Ref": {
      "additionalProperties": false,
      "properties": {
        "content_hash": {
          "pattern": "^[0-9a-f]{64}$",
          "title": "Content Hash",
          "type": "string"
        },
        "id": {
          "minLength": 1,
          "pattern": "\\S",
          "title": "Id",
          "type": "string"
        },
        "version": {
          "minLength": 1,
          "pattern": "\\S",
          "title": "Version",
          "type": "string"
        }
      },
      "required": [
        "id",
        "version",
        "content_hash"
      ],
      "title": "Ref",
      "type": "object"
    }
  },
  "$schema": "https://json-schema.org/draft/2020-12/schema",
  "additionalProperties": false,
  "properties": {
    "approval_ref": {
      "anyOf": [
        {
          "minLength": 1,
          "pattern": "\\S",
          "type": "string"
        },
        {
          "type": "null"
        }
      ],
      "title": "Approval Ref"
    },
    "effective_at": {
      "pattern": "^\\d{4}-\\d{2}-\\d{2}T\\d{2}:\\d{2}:\\d{2}Z$",
      "title": "Effective At",
      "type": "string"
    },
    "kind": {
      "enum": [
        "strategy",
        "horizon",
        "research",
        "risk",
        "cost",
        "retrieval",
        "schedule",
        "universe"
      ],
      "title": "Kind",
      "type": "string"
    },
    "parameters": {
      "items": {
        "$ref": "#/$defs/Parameter"
      },
      "minItems": 1,
      "title": "Parameters",
      "type": "array"
    },
    "profile": {
      "enum": [
        "swing",
        "short_term",
        "long_term"
      ],
      "title": "Profile",
      "type": "string"
    },
    "ref": {
      "$ref": "#/$defs/Ref"
    },
    "schema_version": {
      "const": "2.0.0",
      "title": "Schema Version",
      "type": "string"
    },
    "status": {
      "enum": [
        "unconfigured",
        "fixture",
        "approved"
      ],
      "title": "Status",
      "type": "string"
    }
  },
  "required": [
    "schema_version",
    "ref",
    "kind",
    "profile",
    "status",
    "effective_at",
    "parameters",
    "approval_ref"
  ],
  "title": "Policy",
  "type": "object"
}
